{
  "schemaVersion": 1,
  "id": "page_01HZX8K3Q9EV",
  "siteId": "site_01HZX8K3Q9EF",
  "path": "/events/autumn-meetup",
  "title": "Autumn meetup",
  "locale": "en",
  "status": "published",
  "sections": [
    {
      "id": "sec_01HZX8K3Q9OP",
      "kind": "hero",
      "heading": "The morning briefing, written by an agent"
    }
  ],
  "seo": {
    "title": "Demo Newsroom",
    "description": "Agent-operated news site",
    "noindex": false
  },
  "rev": 7,
  "createdAt": "2026-10-07T20:00:00Z",
  "updatedAt": "2026-10-07T21:00:00Z",
  "availability": {
    "until": "2026-11-15T21:00:00Z"
  }
}
